title,genres,description
Never Alone (Kisima Ingitchuna),casual,"New Game Announcement Nuna and Fox's journey continues in Never Alone 2 - coming soon! About the Game Experience the epic journey of Nuna and Fox as they search for the source of an eternal blizzard that threatens the survival of everything they have ever known. Never Alone is an atmospheric puzzle platformer developed in collaboration with the Iñupiat, an Alaska Native people, drawn from a traditional story that has been shared across the generations. Guide both characters in single-player mode or play cooperatively with a friend as you trek through frozen tundra, leap across treacherous ice floes, swim through underwater caverns and face enemies both strange and familiar. (NOTE: Local co-op play requires at least one Xbox 360 or equivalent game controller). On over 75 ""Best of 2014"" lists and winner of ""Best Debut Game"" at the 2015 BAFTA Games Awards as well as ""Game of the Year"" and ""Most Significant Impact"" at the 2015 Games for Change Awards, nearly 40 Alaska Native elders, storytellers and community members contributed to the making of the game. You'll explore awe-inspiring environments, perform heroic deeds and meet legendary characters from Iñupiaq stories — all narrated by a master storyteller in the spoken Iñupiaq language. Features Play as both Nuna and Fox — Switch between the two companions at any time with one button press, or play side by side in local co-op mode, as you rely on the unique skills of each character to succeed in your quest. Nuna can climb ladders and ropes, move heavy obstacles, and throw her bola at targets to solve puzzles. Fox can fit through small areas that Nuna can't reach, scramble up walls, and jump to great heights. Brave the harsh world of the Arctic — Run under, through, and atop the unstable structures of an abandoned coastal village. Explore the eerily quiet treetops of a mysterious, frozen forest. Brave the fierce winds of the eternal blizzard. Only with the aid of Helping Spirits will Nuna and Fox have any chance of survival in a land where survival seems impossible. Unlock fascinating video insights — Elders, storytellers, and other members of the Alaska Native community share stories and wisdom about their culture, values and the amazing Arctic world encountered by players in over 30 minutes of interviews."
Operation: Tango,casual,"FRIEND PASS About the Game Join our Discord Server NOTES: - This game is online co-op only and requires a microphone. - Thanks to the Friend Pass, any of your friends can play with you for free. - Cross-platform play enabled Operation: Tango is an espionage-themed cooperative adventure challenging you and a friend to complete dangerous missions across the globe in a high-tech near-future world. As an exclusive team of two, you and your partner will become AGENT and HACKER, working in tandem to bring a high-tech global menace to its knees. With only your voice to link you, teamwork is crucial, and communication is key! Now with a FREE CONTENT UPDATE - The Challenge mode introduces a new area to explore, new puzzles to solve, and new robots to hack. Game features: CO-OP PUZZLE SOLVING - Combine skill sets from different points of view to overcome challenges focused on communication, not difficulty. These missions cannot be completed alone. THRILLING ESPIONAGE - Investigate, hack and infiltrate while executing missions across the globe. Live out your ultimate “Hollywood” spy fantasy! HI-TECH TOOLS - Experience the visual splendor and technological advances of a hyper-connected world built around augmented reality. FRIENDLY BANTER - Constant communication makes for both heartfelt and hilarious moments. It’s all about sharing your voice. Multiplayer options: FRIEND PASS - If you own Operation: Tango, any of your friends can play with you for free. All they need to do is download the Operation: Tango Friend Pass on their platform of choice. It takes two to save the world, but it only takes one to pay for it. CROSS-PLATFORM PLAY - Operation: Tango can be played with a person who’s not playing on the same platform as you. It just works."
Plebby Quest: The Crusades,casual,"Welcome to the chaotic world Plebby Quest: The Crusades is a turn-based strategy game set during the crusades of Europe and the Middle East. You must survive between ambitious rulers dreaming of building an empire, treacherous neighbours that long to burn your kingdom, and the religion which always makes unreasonable demands. Survive and build your kingdom’s legacy to last centuries. Hard, Yet Tender After drawing hard and straight outlines, we drew unique faces for our characters. Then we had them stand in front of solid color tone backgrounds and brought them to life with our in-house software. Behold! They laugh, rage, and tells us their stories with their chewy and tender movements. Two Game Modes In Scenario mode you will follow a character’s story, while in Sandbox mode you can conquer the world without any restriction. Each mode is connected and will affect the other. Good choices and decisions from past games will lead your future plays to success. Friend or Enemy? Neighbouring kingdoms remember your behaviour and will react to it. Critical mistakes bring dissent and lead to war. If you react according to a character’s personality, they will open their mind. Accusation In the 11th century, persons without faith were either barbarians beyond the borders, or heretics that were burned at stake. Every kingdom is under the influence of a religion, and will demand your kingdom prove their faith. Conspiracy & Backroom Deals Every June, a meeting is held during which believers of each faith gather to condemn and denounce the others. Kingdoms will condemn one another, while religious leaders will stop a war or demand a crusade. You must do anything possible to turn the participants’ opinion to your liking, including bribes, threats, and all kinds of dirty tricks. All will be forgiven in the name of God. Easy Choices and Terrible Costs There are many choices before you start a war. However, once a war begins, everything will come down to either one of two choices: Will you burn them? Or will you be burnt?"
Ale & Tale Tavern,casual,"You are in for a stunning mix of genres: a coop first-person fantasy tavern simulator in an open world, action, fishing, hunting, exploration, fun and diverse quests. And, of course, COOKING! Play solo or with friends and feed the entire world! The game unfolds in a cozy and beautiful fantasy world. Step into the role of the owner of an abandoned tavern. Work alone or together with your friends to restore the former glory and popularity of the Ale & Tale tavern. Explore new recipes, participate in hunting and fishing, breed animals, grow plants, complete quests involving unique and amusing characters. Decorate your tavern. Fight against dangers. Cook dishes and drinks that will delight your visitors, and they will repay you with ringing coin! And remember: owning your own tavern is fun!! And if you want something else - just explore the world, enjoy its beauty and your complete freedom! Key Features: Play solo or with other players Coop mode for up to 6 people Owl Helpers – Automate Your Tavern! Enjoy superior graphics and a dynamic game world Explore a small, handcrafted open world full of adventures and activities Complete a variety of diverse story quests and meet unique characters inhabiting the game world Engage in whatever your heart desires Tavern management, cooking, decorating your tavern and crafting, delivering orders, growing plants, breeding animals, hunting, fishing, and much more Fight against a variety of enemies and monsters using different types of weapons Dive into an ocean of fun and complete freedom of action. Play the way you want and enjoy true pleasure! The Ale & Tale tavern awaits its heroes!"
Rock 'N' Roll Defense,casual,"WISHLIST BURNING SKIES Burning Skies Neon free for Rock 'N' Roll Defense Owners About the Game Rocked by an explosive soundtrack, choose your band, place your equipments and defend the Rock 'N' Roll from everyone and everything who try to pull it down, on a totally hardcore tower defense! Rock 'N' Roll Defense, is a tower defense game, where you should protect the rock concert from minions who are trying to stop the party! Think you strategy, to get 3 skulls in every one of the 40 stages. Pop, country, dance and even the hell minions are tryin to stop Rock from the spotlight and it's your job to stop them. Use strategy to get coins to place and upgrade the best speakers. 40 stages, 20 enemy types (4 bosses), 8 different speaker (tower) types. 10 music soundtrack by amazing artists, across multiple Rock 'N' Roll Styles (You can download it for free!)"
Madden NFL 22,casual,"GET THE LATEST VERSION OF MADDEN Madden NFL 22 MVP Edition Purchase Madden NFL 22 MVP Edition and receive: Franchise: 40 Staff Points Face of the Franchise & The Yard: The General Player Class starting at level 10 with a Tom Brady Gear Capsule Madden Ultimate Team: Choice of Brady or Mahomes Elite Item 11 Team Fantasy Packs All-new features in Franchise include staff management, an enhanced season engine, and weekly strategy. Share avatar progress and player class between Face of the Franchise and The Yard with unified progression. And for the first time ever in Ultimate Team, adjust Superstar X-Factors at halftime. This game includes optional in-game purchases of virtual currency that can be used to acquire virtual in-game items, including a random selection of virtual in-game items. About the Game Madden NFL 22 is where gameday happens. All-new features in Franchise include staff management, an enhanced scenario engine, and weekly strategy. Share avatar progress and player class between Face of The Franchise and The Yard with unified progression. And for the first time ever in Ultimate Team, adjust Superstar X-Factors at halftime. Franchise Staff management & talent trees Enhanced scenario engine Weekly strategy Unified Progression Avatar progress shared between Face of The Franchise & The Yard New player classes Earn rep via gameplay, and level up Ultimate Team Adjust Superstar X-Factors at halftime Easily manage team chemistries"
missed messages.,casual,"""goth gf's iPhone"" airdrops you a photo. Accept or decline? A romance / horror story about life, death, and memes. A shift in perspective can change everything. Warning: contains mentions of suicide and self-harm. 4 endings 15-30 minutes each play-through Original art and story Wholesome memes Available for Mac, Windows, Linux ･ ｡･｡･ ｡ *"
Milk outside a bag of milk outside a bag of milk,casual,"(How do you feel?) - I definitely feel. Sometimes that's more than enough. (Still, you're anxious, aren't you?) - Of course. Moreover, I'm completely terrified. Was it that obvious? (You're looking in every direction, but not up.) - Ah, this... - I've already told you, haven't I? (About what?) - Ah, you know, small stuff. (Can small stuff make you terrified?) - It's... hard to explain. I climb up the metal railing and let my legs hang down. I sneak short glances at the abyss from time to time. It replies with angry, cold breath. That's how we interact. Like old friends. - Sometimes I feel like the whole world pretends to be crazy. - As if it's trying to make me believe in something that doesn't exist. (That's weird, isn't it?) The game is a sequel to Milk inside a bag of milk inside a bag of milk. The game's events begin the same moment the first game ends. GAME'S KEY FEATURES: Psychedelic narrative full of pyramidal verbal constructions. Stylized pixel graphics which reflect the girl's distorted perception of the world. High variability: each playthrough is unique. However, some dialogue lines, images and scenes have only a small chance of appearing; you'll have to really get close to the girl in order to find out everything she hides. Oppressive and viscous soundtrack. CONTROLS: ESC - pause menu F- fullscreen/windowed mode"
Desolate Wastes: Vendor Chronicles,casual,"Vendor Chronicles puts you in the shoes of a Vendor in post-apocalyptia! Manage your trade, set your defences, deal with locals and fight hordes of mutants in this new perspective on post-apocalyptic survival! Features: Buy and sell goods from apocayptic wanderers! Use your skills to barter a better deal from each transaction - buy low, sell high! Repair broken gear for profit! Hire mercenaries and buy base defences to fight off angry hordes of both monsters and brigands! Awesome retro artwork!"
Ravenous Devils,casual,"Manage a tailor shop and corpse-cooking business in a city where crime, corruption and poverty are commonplace. Percival and Hildred have just moved here with nothing but a dream: to get extremely rich. Take control of Percival to manage the tailor shop , wait for the arrival of clients looking for new suits and dresses, kill them when the moment is right, and throw them down the trap door, leading to the kitchen. Not before stealing their outfits however, their materials ready to be made into brand new clothes: waste not, want not! Take care of Hildred's pub and customers. Feed them delightful corpse-based meals, manage resources effectively and make sure not to run out of ingredients. Increase the reputation of their businesses by buying new tools, learning new recipes and upgrading the shops, but beware... someone knows their secret. Features: - Sharpen your fast paced Point and Click skills - Experience truly Gory gameplay - Upgrade your equipment, cook up new recipes and develop your shops - Meet grotesque characters - 4 hours of playtime to complete the story"
Tomb Joe,casual,"The Sceptre of Gods - a primeval symbol of power wielded only by the greatest leaders of the most dominant ancient civilizations in Central America. Legends state that whoever possessed the artifact would be granted divine wisdom and eternal life. Scolars even claim that without it, the Aztec Empire would have never came to flourish. While most academics considered it to be a myth, a world famous archeologist Tomb Jack recognized there could be some authenticity to the story. After years of research, shrouded in secrecy, he led an expedition to prove the artifact's existance and bring it back to the civilized world. He was able to discover an ancient crypt which led him and his companions to a place none of them could have imagined, even in their wildest dreams. Unfortunately, after many months, none of them returned and soon, all were proclaimed dead. Years later, Tomb Joe, renowned archelogist and a fearless adventurer recieved a mysterious letter adressed to his long lost father. It only contained two things - an ancient map and a golden medallion engraved with the symbol of the Sceptre. While the medallion piqued his interest, it was the map that made him act. For the first time, he learned the destination of his father's expedition. There was no time to waste. Not an hour later, Joe was already on his way to Central America... Embark on a journey to unravel the mystery of the Sceptre of Gods and Tomb Joe's father's disappearance. Armed only with his sharp wit and his trusty whip, Joe will have to face deadly traps, dangerous wildlife, and the best soldiers of the Reich to reach his goal and bring fame to his father's name once again. If he allows the Sceptre to fall into the wrong hands, whole humanity could be doomed. Travel through exotic environments, explore long forgotten tombs, fight or sneak your way past vicious enemies, solve puzzles and try to discover the secret behind the mysterious artifact in this thrilling action-adventure parody platformer."
Death and Taxes,casual,"Wishlist our other games! About the Game In this small Indie, short narrative-based game, you take the role of the Grim Reaper... on an office job. Your job is to decide which people are going to live or die. Your choices will affect the world around you. Keep the chaos away or foil plots to destroy the world and rise through the ranks of Reapers all the way up to MIDDLE-MANAGEMENT, wow ! Death and Taxes is a game in the vein of narrative-based indie titles, such as ""Papers, Please"", ""Reigns"", ""Beholder"" and ""Animal Inspector"", to name a few. The consequences of your choices are yours to bear, while the mystery of your incarnation awaits revelation! Have a.. totally normal.. office job Talk to your boss Get monies Buy stuff from Mortimer’s Plunder Emporium(?) Decorate your desk Do some paperwork Pet the cat?? Stare in the mirror and talk to yourself Don’t let the existential dread set in DONT LET IT SET IN (ONLY THE FATE OF HUMANKIND IS IN YOUR HANDS, IT'S 100% OK) Listen to that one really catchy tune in the elevator Features: Meaningful choices Branching storyline with multiple [SECRET] endings Make-Your-Own-Grim-Reaper! Fully voiced NPCs Original Soundtrack Original artwork featuring watercolour graphics Dialogue options Upgrade shop Twitch integration!"
Viridi,casual,"Nurture a small pot of succulents that grow in real time. Viridi is a safe haven, a place you can return to for a moment of peace and quiet whenever you need it. Leave Viridi open in a second window to keep you company while you work, or check in on your plants as a meditative moment every night. While not fully realistic (they're very forgiving), your succulents will require some maintenance and can die from over- or under-watering. Name your favorite plants, give them special care and attention, and they might even flower for you. Viridi is free to try and comes with your choice of plant assortments. If you think it has a place in your life, you can buy your favorite plants from the in-game nursery for just a few cents a piece. Remember to visit the nursery occasionally for the weekly free seeding!"
Hyperdrive Massacre,casual,"Controller Required! Hyperdrive Massacre was designed from the ground up for the controller and requires a controller to play. About the Game Hyperdrive Massacre is an 80s inspired local multiplayer fragfest for up to 4 players. Players take control of a space cadillac and frag their way to victory against friends or can also play against AI. Both modes allow players to unlock a full crew roster. Submachine guns, sniper rifles, frag grenades, homing missiles and bullet deflectors are just some of the tools player can use to create havoc. Note: this game requires a Controller to play. Hperdrive Massacre is best played on a couch. Although its content is family-friendly, it also makes for an excellent drinking game. 3 solo and local multiplayer game modes: Deathmatch, Death Race, Last Man Standing. Plus 3 local-multiplayer-only game modes: Team Deathmatch, Space Soccer and Spong Local Multiplayer up to 4 players 8 Unique battle arenas 16 space enabled muscle cars, each manned by its own whacky crew 10 instant power up weapons each allowing a different play style Viciously challenging AI for when your friends are not around Rocking original sound track"
Skyborn,casual,"Explore a whole new world from Dancing Dragon Games About the Game Life under the iron rule of the winged Skyborn race isn’t so bad for Claret Spencer, the star mechanic of a successful airship repair shop, present her with broken machinery and she’s sure to fix it. She’s one of the fortunate ones, not all who live under the watchful eye of the Skyborn are so lucky… Little does she know that her stable, comfortable life is about to be turned upside down after the appearance of a certain cravat wearing customer. Follow Claret as she finds herself thrust into an epic, city wide conflict that’s going to take a lot more than elbow grease to fix. Embark on a journey filled with magic, metal and mystery and attempt to unravel the secrets of Skyborn! This game features: Lovable, addicting characters Trendy and exciting Steampunk setting Classic look, modern feel Unique story-driven adventure Multiple character classes Breathtaking orchestral soundtrack"
Little Misfortune,casual,"Update Notes Available September 18, 2019! About the Game Little Misfortune is an interactive story, focused on exploration and characters, both sweet and dark, where your choices have consequences. Starring Misfortune Ramirez Hernandez, an imaginative 8-year-old, who seeks the prize of Eternal Happiness, as a gift to her Mommy. Led by her new friend, Mr. Voice, they venture into the woods, where mysteries are unraveled and a little bit of bad luck unfolds. Sharing the same universe with the cult video game Fran Bow, created by the visionary dev-duo Killmonday Games. 💀Features ⦁ You may pet a doggy, a fishy, a wolfie, the Kraken, the kitty and the foxy. ⦁ Visit a pet cemetery with a shovel. ⦁ Now with real human voices: Hear Misfortune say some pretty cute things! ⦁ Missing children. ⦁ There's a monster! ⦁ Fall in love. ⦁ Commit petty crimes. ⦁ Original art by Natalia Martinsson. ⦁ Original soundtrack by Isak Martinsson."
Cube Racer,casual,"Cube Racer is a round based multiplayer racing game with cubes. Every round, all players race against each other to the finish line. Before every round, the players get to build one or more obstacles on the map. In the next round, all players have to pass all the obstacles, which have been built yet. Features Online/Local Multiplayer Singleplayer Campaign-like Singleplayer Map Editor 300 Different obstacles 25 Standard maps ( + Endless user created maps) Competitive, fun and exciting Controller support for ingame racing Minimalistic, but still nice graphics Online/Local Multiplayer So basically, the game is designed to be a fun multiplayer game. You race against your friends or other players, to finish as fast as possible and score as much points as possible. But instead of giving the winning player an advantage for the following rounds, like it is done in many other games, all players have the same conditions every round, as all players are racing on the same map, with the same obstacles. Besides of the racing, all players extend the map continuously, as every player can build obstacles, boosters or potential deadly objects on the end of each round. This way, the map gets more difficult or easier, but surely more interesting. It's totally up to you! To win in the end, you must collect the most points by scoring as good as possible in every round, outsmarting your opponents with your obstacles and your racing skill. Also, the game comes with a dedicated server, which allows you to set up your own local or online Cube Racer Server. It's a perfect opportunity to play some rounds with your friends, or to have some fun time on a hypothetically LAN-party ;) Singleplayer In Singleplayer, you can challenge yourself to race on different maps with various predefined obstacles to slam the fastest times you are capable of. Obstacles By playing games either in singleplayer or multiplayer mode, you earn credits for your performance. With these credits, you can unlock new types of obstacles time by time. You can also then use the credits to upgrade the obstacles you own, to make them maybe bigger, maybe stronger and develop your personal cube-racing strategy. At the beginning of a game, every player decides, which obstacles to take along into the game, which makes every online-game individual and exciting. Map Editor The game also includes a map editor where you can live your creativity and make your own maps for Cube Racer. You then have the possibility, to either just play your custom maps on your own server, or to upload them to the Steam-Workshop and share your creations with the whole community. Accordingly, you can also browse through other players map creations to download and play your favorite ones."
Botanicula,casual,"Botanicula is a humor-filled adventure game created by the makers of award-winning Machinarium and Samorost series, studio Amanita Design and Czech band DVA. Five friends, little tree creatures, set out on a journey to save the last seed from their home tree which is infested by evil parasites. Key Features: Relaxed game perfect for hardcore gamers, their partners, families and seniors. More than 150 detailed locations to explore. Hundreds of funny animations. Incredible amount of hidden bonuses. Fantastic music and sound effects by fantastic band DVA Not one but five main characters with various skills and personalities. No text or lengthy dialogs to bore you. Bonuses for vigilant players at the end of the game."
