title,genres,description
Feed the Cups,casual,"Update roadmap About the Game ""Feed the Cups"" is a Roguelite multiplayer online cooperative game. Run a Drink Shop, stocking up, preparing ingredients, taking orders, crafting drinks, cleaning up, and checking equipment. Join your friends together! Be careful, as too many mistakes can cause the ""pressure"" to skyrocket! You can immerse yourself in the real-life experience of managing a Drink Shop. Work in different shops, fulfill customer needs, handle inventory and supply management, avoid debt, and control ""stress"" levels. The game currently supports local 2-player or remote multiplayer mode, as well as a 2-4 player online cooperative mode with friends! Have you ever thought of running a drinks shop? Iced lemonade, sweet milk tea, mellow coffee, all made by yourself! Have your hands full alone? Make drinks with your friends! Is someone slacking off? Random challenge choices will bring different buffs to your day. Of course, all power comes at a cost! You can buy furniture and upgrade your house with the cash you earn in the game. The owner won't let you work for nothing at this fun-filled drink shop!"
MONMUSU,casual,Free to Play Idle Simulation Game for PC! You are an up and coming summoner and a lover of monster girls. Earn money to gather up summoning materialsand summon monster girls! Character Designer:Sayori/TAMA/Tsukimi Kirara Graphic Work:Sayori/TAMA/Tsukimi Kirara/33paradox Scenario:Morry
Timberman,casual,"Almost 30 million players could not be wrong - featured as one of the best casual games. Now new Timbermill Mode: 8 Players! And Dark Father as a new timber-hero! Exclusively on Steam: now you can play multiplayer with friend(s) or random opponent from the Internet! Timberman is an oldschool arcade style casual game. Become a Timberman, chop wood and avoid the branches. Sounds like an easy task? It's easy to play but hard to master. 4 variable environments and 32 + 5 exclusive Steam Timbermen to unlock. Master your skills for the top records on the leaderboards. Take your axe as every lumberjack does and chop the tree as fast as you can!"
Rubber Bandits,casual,"Special Offer About the Game Rubber Bandits throws 1-4 players into a wild party brawler to steal, smash, and scavenge as much cash as you can! Prepare for hilarious physics-based combat with wacky weapons and a huge lineup of criminal characters. Dodge deadly traps, bash rival bandits, and race from the cops to commit the perfect heist - but don’t forget to bag the loot! Competitive Criminals : Play with friends or against other Bandits to emerge victorious! Join your partners in crime with local co-op or online to create the perfect criminal dream team. Battle across platforms with crossplay! Lawbreaking Levels : Defy the laws of physics and bust out your bandits from highly destructible levels in classic heist themes like The Bank, The Museum and The Dock and more! Chaotic Capers : Assert your status as Top Bandit across various zany game modes, including Pork Pursuit, Snack Attack, Brawl, Team Brawl, Heist , Carnage, Dodge Bomb, Bomb Panic and Arcade! Can you master them all, and become the ultimate Bandit? Felonious Fashion : Customize your criminal looks in one of many classic bandit disguises: from cowboy outlaw and cat burglar to rubber onesie and banana suit. Wicked Weaponry : Use everything at your disposal to win against your opponents and get the goods! Choose from 20 different weapons, from baguettes leaf blowers to rocket launchers! Use every weapon at your disposal to smash, zap or turn your enemies into giant ice cubes."
Wizard101,casual,"Wishlist the Upcoming Spinoff Game! About the Game A powerful dark magic has engulfed Wizard City and the many worlds of The Spiral. You may be a brand-new student at the Ravenwood School of Magical Arts, but you and your magical spells may be the only hope The Spiral has to thwart the evil forces threatening the balance of everything. Are you up to the challenge? Enroll in the Ravenwood School of Magical Arts and pick one of seven magical schools to specialize in: Balance, Myth, Storm, Fire, Ice, Life, or Death. Each school has its own unique strengths and weaknesses to master and overcome. Prepare for battle by collecting spell cards and building your spell deck. Hone your strategy to unleash powerful magic and defeat foes in thrilling turn-based card combat. Add/remove spell cards before each battle to strategically get the cards you need when you need them! Take down foes solo or team up with friends for maximum efficiency. Uncover secrets, meet hilarious fully voice acted characters, and explore vast worlds in an ever-expanding story. Battle your way through prehistoric times, wild jungles, underwater palaces, and more! With over a thousand hours of questing content and more than 16 worlds to discover, there’s always a new adventure on the horizon. Head to the arena to prove your deckbuilding might! Improve your rank and fight to reach the top of the leaderboard in 1v1 or team-based battles. For even more rewards, participate in tournaments and challenge yourself with special combat rules and restrictions. Earn incredible exclusive rewards in special limited-time events! Events rotate weekly and could consist of fighting waves of enemies in a certain allotted time, rewarding you for activities you already participate in, and more! Take time to relax and rest up before your next big fight with numerous side systems! Hatch and train countless adorable pets, craft mighty weapons and gear, harvest hefty rewards with gardening, reel in your best catches with fishing, or decorate your castle to your heart’s content with housing. You’re never alone in The Spiral. Join and interact with millions of other Wizards across your adventures in this vast MMORPG. Whether you’re looking for assistance with a challenging foe, trading valuable Treasure Cards, or hatching powerful pets, teaming up with friends can be both fun and useful. The Spiral is always expanding with new exhilarating worlds, fun features, and exciting adventures. Join the community and stay up-to-date on what’s new! NEW : As of 11/13/2024, we've implemented a new all-file install process (no more loading as-you-play)! Note, this is for NA Steam players only. At this time, non-Steam players are still using the download as-you-go process, but we are investigating how to eventually implement the all-at-once process for non-Steam players. Like Wizard101? Try Pirate101 - its sister game set in the same universe!"
Cat Goes Fishing,casual,Start out on an island with nothing more than a basic rod. Progress into a radar-wielding master fisher-cat scouring the sea for the biggest and baddest fish. Each fish has unique behaviors that you will learn to exploit as you tailor your arsenal of fishing rods to suit your style of play. Key Features Complete quests to earn cash. Unlock better rods to catch more valuable fish. Customize your rod with upgrades to suit your play style. Unlock boats to travel out onto the sea. Find and equip rare hats that dramatically change the dynamic of the game. Fill your catalog with the fish you catch. Discover what lurks in the dark depths.
The Coin Game,casual,"The Coin Game is a fun-filled arcade adventure on an island packed with ticket games, quirky robots, and endless activities. Explore realistic arcades with machines inspired by modern favorites and swap your tickets for prizes at redemption areas. Head to Larry's Arcade to jam with animatronics Teddy and the Ticket Eaters, or try UFO Arcade's space-themed games, Laser Tag, and Indoor Go-Karting. Don’t miss the ‘90s-style indoor mall with its own arcade, food court, shops, and even a cinema to watch your own movies. Just watch out for the minions – they’re big fans of Teddy and can challenge you in Laser Tag! Looking for more adventure? Make a splash at Lenny's WaterPark or show your skills at mini-golf and RC boat racing at pirate-themed One Eyed Billie’s. And don’t forget the Traveling Carnival with 20+ classic games, rides, and new prizes. For a challenge, Survivor Mode lets you start with limited funds. Keep an eye on your health and energy (right on your wristwatch) by grabbing food around the island. Jerry’s got the healthy stuff if you can afford it, but junk food’s always cheap! Run out of money? Scavenge dumpsters, hop on your bike and deliver newspapers around the island, or hit up the Pawn Shop to sell extra prizes. Otherwise you might have to beg Uncle Phil for some extra allowance! If you just want to relax, activate Birthday Mode and live the good life with unlimited cash courtesy of Uncle Phil. Play however you like and enjoy your time at the arcades! Fill your belly with soda pop and cheesy poofs leaving sticky fingerprints on over 50 different games and machines. There are plenty of ways to travel around the island. Take the bus, your very own golf cart, bike or Mom's van. Or maybe walk to burn all that fast food you just had at the mall. Be careful though, there is lots of highway traffic and tourist activity on the island so make sure to keep off the roads. You can play The Coin Game with any mouse, keyboard or any Dual stick/pad controller. The game includes an easy to use key mapping system to support virtually any controller or peripheral. So you can play The Coin Game any way that you like. Ready for the ultimate arcade escape? Features: 50+ modern inspired arcade machines. 2 modes, Survivor and Birthday for more casual play. Open world full of side activities. Multiple ways to traverse the island in style."
Overcooked! All You Can Eat,casual,"Overcooked! Version Comparison About the Game The Peckish have risen again and it’s your job to satisfy their hunger, are you ready to save the world again? Overcooked! All You Can Eat is a chaotic cooking game where players need to work together (or alone) to serve as many dishes as they can before the timer runs out. Travel through the land cooking up a variety of recipes in evolving and dynamic kitchens. Overcooked! Goes Online For the first time ever, online multiplayer has been fully integrated into Overcooked! Revisit your favourite kitchens from the first game in stunning 4K and ONLINE! Cross Platform Multiplayer Enjoy the cooking chaos with all of your friends using cross platform multiplayer and voice chat. A shared multiplayer queue means reduced waiting times for games, more time for culinary carnage! A Visual Feast! Both games have been taken to the next level with stunning, enhanced 4K visuals - this is the best that the Overcooked! series has ever looked. Tasty New Content! New levels, new chefs and new mayhem - all exclusive to Overcooked! All You Can Eat. Multiple Modes! Players can enjoy campaign, survival and practice modes, and new to All You Can Eat - assist mode! Assist mode offers a number of options to allow for a less frantic game including slower recipe timeout, increased round timers and the option to skip levels. Accessible For All! Overcooked! All You Can Eat contains features to allow as many players as possible to join in the food frenzy! Scalable UI, dyslexia friendly text and colour blindness options are all available."
Journey To The Center Of The Earth,casual,"You Love Riddles and to Combine Logically? You Love Jump 'n' Runs? You don't want to fight but you still want a challenge? Then you will love this Journey to the Center of the Earth! Control 3 Adventurers with unique powers at the same time, or guide them individually in this narrative 2D puzzle platformer based on the Jules Verne novel, and make your way through 18 expansive levels, solve puzzles, avoid traps, not die of thirst and find the well hidden secret at the center of the Earth. Features classic puzzle platformer gameplay 18 giant levels 3 characters with unique powers control all 3 heroes at the same time, or guide them individually survival mechanic no combat lots of secrets to uncover world based upon the Jules Verne novel Become part of our InSayn Community Steam-Group: Twitter: Facebook:"
Of Guards And Thieves,casual,"Of Guards and Thieves is a multiplayer stealth game in which high-powered guards face off against fast and elusive thieves in a contest of wits. Outsmarting the enemy and shooting your way through to the goal are equally valid strategies. A game with simple rules, emergent gameplay and high replayability, Of Guards and Thieves is sure to be a showstopper in your gaming collection! KEY FEATURES: - Asymmetric Stealth multiplayer tactical action. - Easy to play, hard to master! - Lots of Operators with unique Gadgets, Weapons, and play style. - Huge selection of Competitive and Fun game modes. - Innovative Dynamic Lighting System. - Interactive Environment. - Rich and Deep Tactical Teamplay! - Customizable Operators and Weapon's esthetics. - Map Workshop with thousand of user-made maps to explore! - Dedicated server - Enjoy the game on our 24/7 dedicated servers, bigger game, less lag, more fun! - Private lobby hosting to have fun with your friends. - Leveling System with experience points and 80 unlockable levels."
Pixel Puzzles Ultimate Jigsaw Puzzles,casual,"Every puzzle cut is a one of a kind, in shapes no physical jigsaw could be. Our jigsaws feature piece counts from 21 to all the way up to a huge 1410 pieces. Pixel Puzzles Ultimate brings you full size professional puzzles to the digital world. Customize the game the way you want it! Full range of options and settings to tweak the game as you see fit. Multiple themed play environments, Fully customizable for you to get the puzzling experience you’re looking for! FEATURES: 🧩 Full range of sizes from 21 to 1410 pieces. 🖼️ Beautiful puzzle images. 💾 Auto saving, never lose your progress. 😇 Peaceful puzzling atmosphere. 🎲 Traditional puzzle gameplay. 🔧 Wide range of customization options. ⛩️ Multiple interactive play environments. ⭐ Power ups and hints to help solve puzzles. Pixel Puzzles Ultimate, the definitive jigsaw puzzler for the PC platform. No longer will a puzzler be left looking for that last piece, never again will the kitchen table be covered in tiny wooden shapes."
ISLANDERS,casual,"A quick note from the developers: You want to build beautiful cities without investing hours on end into stressful resource management? Say no more! ISLANDERS should be right up your alley. ISLANDERS is a minimalist strategy game about building cities on colorful islands. Explore an infinite number of ever-changing new lands, expand your settlements from sprawling villages to vast cities and enjoy the relaxing atmosphere. If you’re thinking about buying ISLANDERS please keep in mind that we are a very passionate but small team of three. This is not a blockbuster experience with hours and hours of content. What we’d like to offer you is a simple game that lets anybody create and explore their own little worlds, while providing enough depth for players who want to challenge themselves. And you can get it at the price of a medium sized pumpkin spice matcha caramel latte. Please don't hesitate to contact us if you have feedback, questions, or problems with the game. We’ll do our best to get back to you as quickly as possible and provide support if needed. Also let us know if you enjoyed the game, because that makes our day! This game offers you: Intuitive and rewarding city building gameplay Endless amount of procedurally generated islands A relaxing atmosphere Beautiful, vibrant colors Great for playing every now and then, discovering some new islands and beating your high score This game doesn’t have: Helicopters Guns Lootboxes A cinematic story Huge explosions (not even small ones actually) Online multiplayer Microtransactions Orcs Wanna know the specifics? The gameplay of ISLANDERS is pretty intuitive. You start with a set of buildings in your inventory that you can place on your island. Placing buildings is rewarded with points. The amount of points you get depends on what surrounds the buildings when you place them. Gather enough points to refill your inventory and unlock new buildings. Once your city is big enough you may choose to travel to the next island (they are generated procedurally, so you can literally keep exploring forever). If you run out of buildings the game ends. This is where you high five yourself for beating the high score, take a proud last glance at the epic city you've built and start just one more round... ISLANDERS is inspired by amazing games like: Bad North Anno The Settlers Sim City Kingdoms and Castles"
Shop Heroes,casual,"NOTICE: The sequel to the long anticipated hit game Shop Heroes, has recently been released worldwide and now available on Steam. Shop Legends contains all of the features that the classic game offers and much much more in terms of new systems, events, lore and expanded gameplay! Shop Legends will be updated on a bi-weekly basis, with a roadmap spanning over the next 2 years in terms of updates and new features to be continously and regularly added! We hope for the community to rejoin us in the brand new Legends as other shopkeepers and Aragonia awaits yout awakening!"
Impostor Factory,casual,"Wishlist the series' Beach Episode! (seriously, it's a thing.) Where it all began: About the Game ------------------------------------------------------------------------------------------------ Impostor Factory is a narrative-driven adventure game that is categorically out of its mind. ------------------------------------------------------------------------------------------------ Dr. Watts and Dr. Rosalene have peculiar jobs: They give people another chance to live their lives, all the way from the very beginning. But this isn't their story. Probably. Instead, it's about Quincy . Let me tell you a story about him. One day, Quincy was invited to a fancy parteh at a suspiciously secluded mansion. So, he accepted and went; because even though the mansion was suspicious and secluded, it was also fancy and had a parteh. In fact, it turned out to be so fancy that there was a time machine in its bathroom. Quincy could wash his hands and time-travel while he was at it. Talk about a time-saver! But of course, then people start dying, because that's what they do. And somewhere along the way, things get a little Lovecraftian and tentacles are involved. Anyway, that's around 1/3 of what the game is really about. ------------------------------------------------------------------------------------------- Key Features A story that will make you curse at the screen A cozy mix between adventure game elements and classic RPG aesthetics Dialogues that read so wrong but feel so right An espresso execution with zero filler and no time drains long cat ------------------------------------------------------------------------------------------- F.A.Q.: Q: Is playing To the Moon and Finding Paradise mandatory before playing this game? A: Impostor Factory can be played independently, just like the games before it. But the order of playing would affect the experience. Q: Is Impostor Factory the sequel to To the Moon and Finding Paradise? A: Maybe not. Maybe it's a sequel. Maybe it's a prequel. Maybe it's both."
Reversion - The Escape (1st Chapter),casual,"You wake up in a hospital guarded by armed soldiers. Memories gone, you’re told it’s 2035, and Buenos Aires has fallen to a paramilitary organization. Now, you must use your puzzle-solving skills to escape and uncover the truth of what happened to your city. And who you really are. Guide the protagonist, Christian, through the hospital grounds on a search for answers. What really happened 20 years ago to destroy the city? Why can’t you remember anything since? Team up with Victoria, a fellow patient (or prisoner) with an equally mysterious past. Together, you must make a bid to escape before the guards catch up with you. Only then will you have a chance to reverse the disastrous events that destroyed the city as you know it. Your adventure starts now. It’s time for Reversion. Features: Charismatic and mysterious characters Challenging puzzles to keep you hooked Wide variety of interactive objects in each scene Classic 2D graphics, as in the golden age of the genre Hand-drawn and digitally-colored animation Voice acting Hints system to help you when you’re stuck Other Reviews (iOs Version) (iOs Version)"
Catch a Falling Star,casual,"Catch a Falling Star is a casual and relaxing game where the aim is to catch falling stars and score points. A fun and relaxing game with beautiful graphics and soothing music - perfect for when you want to play something, but don't want to think too much. Features 3 Beautifull themes each with their own music 22 Extra baskets to unlock and catch stars in style Catch falling stars to score points Your basket fills up as you catch stars, but only once you deposit on either side of the screen, you score the points Avoid falling ice, which slows you down and take up valuable space in your basket Wind blows from either side, pushing objects in that direction Various power-ups, like a speed boost, extra life, no wind, etc. Avoid hazards like lose a life, slow basket, fast stars, more ice, etc. Catch star coins, with which you can unlock more basket space, additional baskets (more than 20 designs), more themes, or one-use power-ups for while you play Submit your score to our online leader boards Controller support So, if you are looking to sit back and relax, why not catch some stars!"
Return to Monkey Island,casual,"Return to Monkey Island is an unexpected, thrilling return of series creator Ron Gilbert that continues the story of the legendary adventure games The Secret of Monkey Island and Monkey Island 2: LeChuck’s Revenge developed in collaboration with Lucasfilm Games. It’s been many years since Guybrush Threepwood was last locked in a battle of wits with his nemesis, the zombie pirate LeChuck. His true love, Elaine Marley, has turned her focus away from governing and Guybrush himself is adrift and unfulfilled, having never found the Secret of Monkey Island. Hip, young pirate leaders led by Captain Madison have shuffled the old guard from power, Melee Island has taken a turn for the worse, and famed businessman Stan has been imprisoned for ‘marketing-related crimes’. Banter with old friends and new faces on familiar islands now under dangerous new leadership. Then, take to the high seas and explore the new and unknown as you work your way out of tough predicaments. Clever puzzles, bizarre situations, and devastating ripostes are all that stand between Guybrush and glory. Return to Point & Click Swashbuckling Bringing classic point and click gameplay to the modern-day, intrepid pirates will solve puzzles and explore the islands with a clever evolution of classic adventure game controls. Context-sensitive interactions, reactive dialog trees, and an easy-to-use inventory system make pirating a breeze. Embark on Archipelago Adventures Navigate the sometimes-friendly confines of Melee Island, a familiar place that finds itself under new management by leaders who have put the squeeze on old friends and new faces. Venture out into uncharted lands like the aptly named Terror Island and the chilling outposts of Brrr Muda to make allies and enemies alike. Created by a Legendary Crew The new chapter in the Monkey Island series marks the return of the iconic series’ creator Ron Gilbert, joined by game co-writer Dave Grossman, art director Rex Crowle (Knights & Bikes, Tearaway) and composers Peter McConnell, Michael Land, and Clint Bajakian (Monkey Island, Monkey Island 2: LeChuck’s Revenge)."
Sonic Origins,casual,"Feature List About the Game The Blue Blur is back with an expanded multi-game collection of classic Sonic the Hedgehog games - Sonic Origins Plus! Sonic Origins Plus features the four beloved classic titles in Sonic Origins – Sonic the Hedgehog, Sonic 2, Sonic 3 & Knuckles, and Sonic CD with remastered visuals, bonus characters, added modes, challenges, behind-the-scenes content and more while adding significant improvements. This bundle also includes 12 Sonic Game Gear titles, previously released add-on content, playable Knuckles in Sonic CD, and for the first time ever, Amy Rose as a playable character in Sonic the Hedgehog 1, 2, Sonic 3 & Knuckles, and Sonic CD! With more content than ever before, this is the definitive way to experience these classic games! Classic Redefined Explore 4 classic remastered Sonic titles – Sonic the Hedgehog, Sonic 2, Sonic 3 & Knuckles, and Sonic CD in high-definition, with all-new opening and ending animations for each title! Classic and Anniversary Modes Spin Dash your way through numerous zones in Classic mode with the game’s original resolution and limited lives, or the new Anniversary Mode with unlimited lives in revamped widescreen HD. New Unlockables Complete missions and unlock Mirror Mode, new stages, challenges, behind-the-scenes content, a music player, animated shorts, special stages, and more! Game Gear Titles Play 12 classic Sonic Game Gear titles, including hits like Sonic Drift 2, Sonic Spinball, and Tails Adventure! New Playable Characters Play as Sonic, Tails, Knuckles or – for the first time ever – Amy Rose in Sonic the Hedgehog 1, 2, Sonic 3 & Knuckles, and Sonic CD! All-in-One Bundle Sonic Origins Plus includes the Classic Music Pack and Premium Fun Pack, which contain Extreme Missions, Mirror Mode, additional screen borders, new character animations in menus, added music from other Sonic titles, and more!"
