title,genres,description
Unturned,casual,"STAY UNTURNED You're one of the few not yet turned zombie. Keeping it that way will be a challenge. Go in guns blazing and attract the attention of everything, living and dead. Take a subtle approach sneaking around and making use of distractions. Confront and learn to counter special abilities ranging from invisibility to fire breathing to lightning attacks. STRUGGLE AGAINST NATURE Zombies aside nature does plenty to make life hard. Forage wild fruits and vegetables. Hunt animals for pelts and meat, or in some hostile environments become the prey. Fish for food and garbage. Plant a crop and make sure it gets rain. Seek warmth and take shelter from blizzards. DEAL WITH OTHER PLAYERS Friend or foe there's a lot of interesting people online. Arrest bandits with handcuffs and blindfold them as a non-lethal strategy. Fight with every kind of weapon under the sun - swords, machine guns, snipers, missiles, landmines - you name it. Raid enemy encampments using charges and detonators and steal their loot. For pure PvP play arena mode in a last man standing battle to the death, or PvE for peaceful cooperation. Roleplay servers encourage everyone to stay in character and tell a story together. HELP THE NEW SOCIETY Plenty to do even if you're offline or going solo. Meet, talk and trade with NPCs. Complete quests to aid NPCs and progress the story. Fend off waves of the undead to clear hordes. Secure airdropped supplies. Gear up with gasmasks to scout radioactive deadzones. FORTIFY YOUR STRONGHOLD Somewhere to kick back and chillax or a hideout to direct your gang, whatever floats your boat (in this case sometimes literally). Build with barricades, furniture, traps, machinery and more. Board up the windows of existing structures to survive the night. Craft an entirely new structure from supplies you collect. Turn your vehicle into a moving fortress by building on it. TRAVEL BY LAND, AIR AND SEA Roll out in style with a fully stocked garage. Land vehicles including tanks, quads and snowmobiles. Air vehicles from helicopters to seaplanes to fighter jets. Sea vehicles such as jetskis and hovercraft. Maintain your vehicles with tires, batteries and fuel. EXPLORE MASSIVE WORLDS With 5 officially developed and 1 curated community created sandbox map there's a wide variety of locations to discover: Prince Edward Island (PEI) The Yukon Washington Russia Hawaii Germany MOD EVERYTHING From the ground up Unturned was designed for modding. Download player created content ranging from guns to vehicles to huge levels from the workshop, and upload your own. Build custom maps using the in-game level editor. All of the official maps were created with the same free public tools and their assets are open for you to use. Write plugins using built-in or strong third party systems. Get your apparel and skins upvoted in the workshop for consideration to be accepted and sold. Team up with other modders and put together your own update for consideration to be officially adopted. NEAT STUFF I think these features are neat and they didn't fit anywhere else. There's many more I want to include but for brevity's sake: Most objects can be destroyed to create new pathways. For immersion you can pick a frequency and use two-way radios to communicate with your squad rather than external voice chat programs."
Wallpaper Engine,casual,"Wallpaper Engine enables you to use live wallpapers on your Windows desktop. Various types of animated wallpapers are supported, including 3D and 2D animations, websites, videos and even certain applications. Choose an existing wallpaper or create your own and share it on the Steam Workshop! In addition to that, you can use the free Wallpaper Engine companion app for Android to transfer your favorite wallpapers to your Android mobile device and take your live wallpapers on the go. NEW: Use the free Android companion app to transfer your favorite wallpapers to your Android mobile device. Bring your desktop wallpapers alive with realtime graphics, videos, applications or websites. Use animated screensavers while you are away from your computer. Personalize animated wallpapers with your favorite colors. Use interactive wallpapers that can be controlled with your mouse. Many aspect ratios and native resolutions supported including 16:9, 21:9, 16:10, 4:3. Multi monitor environments are supported. Wallpapers will pause while playing games to save performance. Create your own animated wallpapers in the Wallpaper Engine Editor. Animate new live wallpapers from basic images or import HTML or video files for the wallpaper. Use the Steam Workshop to share and download wallpapers for free. Wallpaper Engine can be used at the same time as any other Steam game or application. Supported video formats: mp4, WebM, avi, m4v, mov, wmv (for local files, Workshop only allows mp4). Use the free Android companion app to take your favorite scene and video wallpapers on the go. Support for Razer Chroma and Corsair iCUE. Wallpaper Engine aims to deliver an entertaining experience while using as few system resources as possible. You can choose to automatically pause or completely stop the wallpaper while using another application or playing fullscreen (including borderless windowed mode) to not distract or hinder you while playing a game or working. Many options to tweak quality and performance allow you to make Wallpaper Engine fit your computer perfectly. As a general rule of thumb, 3D, 2D and video based wallpapers will perform best, while websites and applications will require more resources from your system. Having a dedicated GPU is highly recommended, but not required. Choose from over a million free wallpapers from the Steam Workshop with new wallpapers being uploaded every day! Can't find a wallpaper that fits your mood? Let your imagination go wild by using the Wallpaper Engine Editor to create your own animated wallpapers from images, videos, websites or applications. A large selection of presets and effects allow you to animate your own images and share them on the Steam Workshop or to just use them for yourself."
Garry's Mod,casual,"Steam Workshop About the Game Garry's Mod is a physics sandbox. There aren't any predefined aims or goals. We give you the tools and leave you to play. You spawn objects and weld them together to create your own contraptions - whether that's a car, a rocket, a catapult or something that doesn't have a name yet - that's up to you. You can do it offline, or join the thousands of players who play online each day. If you're not too great at construction - don't worry! You can place a variety of characters in silly positions. But if you want to do more, we have the means. Beyond the Sandbox The Garry's Mod community is a tremendous source of content and has added hundreds of unique modes to the game. In Trouble In Terrorist Town, you can be a detective solving an online murder as criminals attempt to cover up their homicides. Be a ball, a plant, a chair, or anything else in Prop Hunt's elaborate, shape-shifting game of Hide & Seek. Elevator: Source is gaming's first elevator thrill ride, delivering players to airlocks and kitten dance parties. We have one of the most vibrant Steam Community Workshops, with over 300'000 models, maps, and contraptions to download. It has everything from new tools to improve your builds, to guns that fire rainbow-tinged nuclear blasts from space. Take as much or as little as you need: it’s all free. Please note: Some multiplayer servers and game-modes might require you to own other games - such as Counter-Strike: Source and Team Fortress 2."
VRChat,casual,"Imagine a space filled with limitless possibilities. Spend your afternoon dogfighting in fighter jets, before winding down in a treehouse that exists floating in a nebula. Make a new best friend while exploring a haunted mansion, right before playing a hand of cards with a robot, alien, and eight-foot tall wolf. In VRChat, there are hundreds of thousands of worlds, millions of avatars – all created by the users . No matter what you’re into, there’s a space in VRChat for you. And if there isn’t, we’ll give you the tools to make your dream a reality. While not required to join in on the fun, VRChat was built to take advantage of VR headsets in many unique ways. That means avatars that flow with your movement, and systems that work alongside various hardware platforms to provide full-body tracking, finger tracking, and much, much more. There’s something magical around every corner. Come take a look, and see what you find. In VRChat, there’s always something to do – and people to meet there. Visit a planetarium and have a chat about astronomy. Go on a virtual hike through a majestic fantasy forest. Pull up to a car meet, and talk shop with some gearheads. Attend a live music event underneath a chemical storage facility, and talk obscure genres with DJs. Once you find your crowd, join their Group, and you'll be able to find them again the next time you're on. Your community – whatever it is – is here. There are thousands of games to play in VRChat. Try running a kitchen in a busy restaurant, or racing go-karts in zero gravity. Fancy a battle royale? We’ve got those, too -- just probably with a wider diversity of avatars than you’ve ever seen before. It doesn’t matter what you like to play: casual card games, shooters, racing, platformers, puzzles, horror, and of course, endless party games. If you want to play it, it probably exists here (and if it doesn't, you can build it yourself). Everything here was built by the community using the VRChat SDK. Combined with Unity and Udon, our in-house scripting language, we give our users as much power as possible to build whatever their imaginations can conjure up. But creation isn’t just limited to worlds. VRChat provides a level of creative freedom that is unmatched anywhere else, and nowhere is that reflected best than on the avatars of our users. In VRChat, you can be anything, and explore your identity however you’d like. Want to be an alien? A talking dog? A sentient shoe with glowing bits that react to the beat of music by changing color? I mean, sure, if that’s what you’re about. Come on in -- hundreds of thousands of worlds (and a whole bunch of new friends!) are waiting for you."
Among Us,casual,"Play with 4-15 player online or via local WiFi as you attempt to prepare your spaceship for departure, but beware as one or more random players among the Crew are Impostors bent on killing everyone! Originally created as a party game, we recommend playing with friends at a LAN party or online using voice chat. Enjoy cross-platform play between Android, iOS, PC, and console. Win by completing tasks to prepare the ship or ejecting all Impostors. React quickly to undo the Impostor's sabotages. Check the Admin map and Security cameras to keep tabs on other Crewmates. Report any dead bodies immediately to start discussion of who the suspected Impostor is. Call emergency meetings to discuss suspicious behavior. Vote to eject suspected Impostors. Kill Crewmates and frame bystanders. Pretend to run tasks to blend in with the crewmates. Sneak through the vents to quickly move about the ship. Use sabotages to cause chaos and divide the crew. Close doors to trap victims and kill in private. Features Customization: Pick your color, hat, visor, skin, and pet. Lots of game options: Add more Impostors, more tasks, different roles, and so much more! Different modes to choose from: Classic or Hide n Seek. 4 different maps to play in: The Skeld, MIRA HQ, Polus, and the Airship. Quickly find a game online from the host list. In-game text chat. Rich Discord integration. Cross-platform play between PC, console, Android, and iOS!"
Fall Guys,casual,"You’re invited to dive and dodge your way to victory in the pantheon of clumsy. Rookie or pro? Solo or partied up? Fall Guys delivers ever-evolving, high-concentrated hilarity and fun. Prefer to be the maverick behind the mayhem? Build your very own obstacle course to share with friends or the wider community. Create your own Course: Fall Guys Creative is a level editor that allows you to create fiendish custom Rounds and share them with the wider community. Competitive & Cooperative: Tumble between competitive free-for-alls and cooperative challenges—or take on the Blunderdome with up to 3 friends! Play with Friends: Fall Guys supports cross-play, cross-platform parties and cross-progression via your Epic Games Account. Ever-Evolving Content: Play stays fresh with new collabs and game updates which bring new Costumes, Obstacles, and ways to play. Gloriously Customizable: Choose from a multitude of Colors, Patterns, Costumes and Nameplates. Relish wins with extravagant Celebrations and share your flair with Emotes! Items shown may require separate purchase from the in-game store and are subject to availability. Contains in-game purchases."
Battlefield™ 2042,casual,"Battlefield™ 2042 Elite Edition Get the definitive version of Battlefield™ 2042. Packed to the brim with value, Battlefield 2042 Elite Edition contains: 4 Seasons' worth of content instantly unlocked: Battle on 17+ maps, wield over 35 weapons, deploy as 14 Specialists “Lost World” Epic Cosmetic Bundle* containing: Epic “Forsaken” Rao Specialist Set Epic “Starved Vulture” Vehicle Skin Epic “Banisher” Weapon Skin This game includes optional in-game purchases of virtual currency that can be used to acquire virtual in-game items. About the Game WELCOME TO 2042 Battlefield™ 2042 is a first-person shooter that marks the return to the iconic all-out warfare of the franchise. With the help of a cutting-edge arsenal, you can engage in intense, immersive multiplayer battles. Lead your team to victory in both large, all-out warfare and close-quarters combat on maps from the world of 2042 and classic Battlefield titles. Find your playstyle in class-based gameplay and take on several experiences, including elevated versions of Conquest and Breakthrough. Explore Battlefield Portal, a platform where players can discover, create, and share unexpected battles from Battlefield's past and present. ALL-OUT WARFARE This game includes optional in-game purchases of virtual currency that can be used to acquire virtual in-game items."
SMITE®,casual,"Join 40+ million players in SMITE, the Battleground of the Gods! Wield Thor’s hammer, turn your foes to stone as Medusa, or flex your divine power as one of 100+ other mythological icons. Become a God and play FREE today! Unleash each deity’s unique strategies, legendary weapons, and earth-shattering powers. Rain lightning down upon your foes as Zeus, assassinate from the shadows as Loki, or transform and trick your foes as the Monkey King, Sun Wukong. Which God will you choose? Unlike other MOBAs, SMITE puts you directly onto the battlefield with a third-person action viewpoint. From blind-side ambushes to aimed shots, a new pantheon of strategic possibilities awaits. Never played a battle arena before? Don’t worry. Auto-buy, auto-level, and the deathmatch-like Arena mode let you jump right into divine MOBA action. Aspiring pro? Top the ladders, join a competitive team, and you too could be playing at the SMITE World Championship."
The Sims™ 4,casual,"The Sims is on Discord! About the Game Unleash your imagination and create a unique world of Sims that’s an expression of you. Download for free, and customize every detail from Sims to homes and much more. Choose how Sims look, act, and dress, then decide how they’ll live out each day. Design and build incredible homes for every family, then decorate with your favorite furnishings and décor. Travel to different neighborhoods where you can meet other Sims and learn about their lives. Discover beautiful locations with distinctive environments and go on spontaneous adventures. Manage the ups and downs of Sims’ everyday lives, and see what happens when you play out scenarios from your own real life. Tell your stories your way while developing relationships, pursuing careers and life aspirations, and immersing yourself in this extraordinary game, where the possibilities are endless. Download for free — The base game of The Sims™ 4 is free to download. Get a plethora of options for building homes, styling Sims, and customizing their personalities. Craft their life stories while exploring vibrant worlds and discovering more ways of being you. Get more with EA Play — EA Play members can expand their career possibilities with The Sims 4 Get to Work Expansion Pack."
Human Fall Flat,casual,"***NEW LEVEL 'VIKING' AVAILABLE NOW*** DAVE THE DIVER JOINS HUMAN FALL FLAT FOR A VIKING ADVENTURE A brand new Viking level for Human Fall Flat is available to download right now! As well as a whole lot of plunderous puzzle platforming for you to get stuck into, we’re also delighted to welcome DAVE THE DIVER to the Human crew! Download the update today and you’ll automatically unlock two completely new skins themed around everyone’s favourite deep sea diver. Explore a Viking-themed level packed with plenty of new platforming puzzles for you and your friends to sink your teeth into. Lay siege to the village on arrival, ride a catapult high up the mountainside, then blag a battering ram to slam a huge hunk of rock into the chasm ahead. Take a barrel-ride through the frosty fjords and join your friends on a longboat ride to victory! Enjoy Human Fall Flat in style with two new skins themed around our special guest star DAVE THE DIVER! Join 55 million players across all formats, and explore more than 5,000 unofficial levels from our community creators too! Human Fall Flat is a hilarious, light-hearted physics platformer set in a world of floating dreamscapes. Each dream level provides a new environment to navigate, from mansions, castles and Aztec adventures to snowy mountains, eerie nightscapes and industrial locations. Multiple routes through each level, and perfectly playful puzzles ensure exploration and ingenuity are rewarded. Need a hand getting that boulder on to a catapult, or need someone to break that wall? Online multiplayer for up to 8 players transforms the way Human Fall Flat is played. Your Human is yours to customise. With outfits from builder to chef, skydiver, miner, astronaut and ninja. Choose your head, upper and lower body and get creative with the colours! The Human Fall Flat Workshop, unique to Steam, is a fantastic tool which, used alongside Unity, enables players to build their own Human Fall Flat content and share it with others around the world. Not interested in building levels, lobbies or skins yourself? You can also download more than 5000 different levels and explore other people's creations directly from Steam! Streamers and YouTubers flock to Human Fall Flat for its unique, hilarious gameplay. Fans have watched these videos more than 3 Billion times!"
Trove,casual,"Grab your friends, hone your blades, and set off for an epic procedurally generated adventure in Trove, the ultimate action MMO! Battle the forces of Shadow in realms filled with incredible dungeons and items created by your fellow players. Whether hunting treasure in far-off lands or building realms of your own, it’s never been this good to be square! Cubular Classes Play as a Knight, Gunslinger, Ice Sage, Dracolyte, Pirate-with-a-parrot, or any (or all!) of the other Classes in Trove while mastering abilities from deadly ninja techniques to deliciously deadly ice cream crushes. Upgrade your gear to tackle epic challenges and strut your stuff with killer looks. Infinite Realms Every playthrough is unique! Explore through fully destructible procedurally generated realms on the backs of fire-breathing dragons and purrfectly whiskered Meownts. Jump into action tailored to any level as you conquer untamed wilds from the Treasure Isles to Candoria, home of the sweet-toothed Candy Barbarians. Delve into Dungeons Assemble a group of hardy cube-kind and crawl your way through huge dungeons unique to each realm. Brave deadly minions, bosses, and traps to “liberate” powerful armor and weapons, or dip into smaller Lairs for single servings of danger perfect for solo fun. Get Rich with Loot Rake in a shimmering hoard of treasure and collectible items from the deepest and darkest places in Trove. Load up on special gear, costumes, decorations, recipes, crafting ingredients, flying carpets, sea-faring ships, and dragons of mighty renown. Build Your Home… Cornerstones are personal homes you can build block by block, but they’re also mobile bases! Drop your Cornerstone at specially-marked plots in any world you’re visiting, and voilà: your hand-crafted home-away-from-home will appear, giving you a place to kick back, relax, and craft to your heart’s content. Build a World… What’s better than crafting alone? Building entire new Club Worlds with friends. Feel like making enormous geodesic domes in the desert? Magnificent castles in the sky? Do it – and land yourself in our list of the cubic masterpieces in Trove! Build Anything in the Game! Dragons? Check. Bacon swords? Yup. Rainbow-grade 3D glasses of insufferable doom? Just the tip of the iceberg! Collect a HUGE range gear made by your fellow players and make and submit your own items – including Dungeons, Lairs, Class Costumes, and more. Plus Music Blocks, Meownts, Fishing, Farming, Pets, Sailing (with Boats!), Flying (with Wings!), Mag Trains, Dance-Pads, Heroes, Villains, Allies (who might be Villains), Flasks, Bombs, Piñata Parties, and the Crafting of any and all Things. Did we mention it’s free to play?! Like Trove? Try RIFT to delve into more multidimensional realities!"
Castle Crashers®,casual,"Hack, slash, and smash your way to victory in this 2D sidescrolling arcade adventure from The Behemoth! Play with up to four friends locally or online to defend the kingdom, save the princesses, and crash some castles! Key Features Unlock more than 25 characters and over 40 different weapons! Level up your character with skill points and adjust Strength, Magic, Defense, and Agility to your liking. Intuitive magic and combo system: unlock an arsenal of new attacks as your character progresses through the game. Local or online co-op gameplay: pick up and continue the adventure with your friends at the drop of a helmet! Collect adorable animal orbs for your companions, each with different abilities to aid you on your journey. Game Modes Arena: battle other players in team matches or free-for-all! Insane Mode: test your skills in the ULTIMATE campaign challenge! Back Off Barbarian: jump and hop across the level to avoid the enemies in this minigame! DLC Enhance the standard gameplay experience with the Blacksmith and Pink Knight character packs, or unlock Paint Junior and custom character capabilities with the new Painter Boss Paradise DLC! The Painter Boss Paradise DLC also includes: A custom character template New art for all official playable characters and weapons! New map art for fancier adventuring! Endless knightly possibilities - choose from community characters or preloaded characters created by our team! Worried about buying the DLC and missing the nostalgic feel of the original art? Have no fear, as you can toggle the Painter Boss Paradise DLC’s functionality on or off from the main menu at any time to experience the classic adventure! Check out the DLC store page linked above to learn more!"
A Story About My Uncle,casual,"A Story About My Uncle is a first person platforming adventure game about a boy who searches for his lost uncle, and ends up in a world he couldn’t imagine existed. Take help of your uncle’s mysterious inventions that let you jump incredibly high and far through beautiful scenery, uncover clues to your uncle’s whereabouts, and meet fantastical creatures that will help you on your journey. The movement in A Story About My Uncle is a crucial part of its core gameplay – focusing on swinging through the world with a grappling hook that gives the player a wonderful sense of speed and freedom. Soar through a game world with a unique art style and a mysterious story that unravels before you. Key features Grappling hook: An empowering mechanic that gives you a sensation of speed, flow and vertigo like you’ve never experienced before. Explore the world: Visit a wonderful and exciting world - from paradisal caves, to lost civilizations and harsh, mystical landscapes. Emphasis on story: While searching for your uncle you will meet creatures with stories and fates of their own. Take your time to explore the world to dig deeper into the narrative. Non-violent: A Story About My Uncle is a First Person game, but it is driven by non-violent gameplay and a heavy emphasis on story and atmosphere."
