title,genres,description
BLEACH Brave Souls,casual,"The world of mega-hit manga and anime BLEACH comes to Steam in this exciting 3D action game! Build a team using your favorite characters from the BLEACH universe! Play on the PC or your smartphone with the same account! EXCITING 3D ACTION 3D graphics and simple controls make for free-flowing and fast-paced hack-and-slash action. Play in single-player mode or team up with three other players for online co-op! EPIC SPECIAL MOVES Unleash each BLEACH character's unique special moves to carve your way to victory. Special moves are fully voiced by the original Japanese anime voice actors. THREE'S COMPANY Combine your favorite characters into teams of three. You can even make combinations of characters you would never see in the original story. The possibilities are almost limitless! RELIVE THE BLEACH STORY Follow the BLEACH story from the moment Rukia and Ichigo first meet. Develop your characters as you complete quests that recreate pivotal scenes from the story. PLAY WITH & AGAINST OTHER PLAYERS Pit your best warriors against other players' teams and vie for the top spot in weekly PvP leagues, or go online and team up with other players in exciting PvE Co-Op Quests and Epic Raids! DEVELOP YOUR CHARACTERS Brave Souls features a highly flexible character improvement system that allows you to create exactly the warriors and the team you want. Enter battle and earn experience to level up characters and improve their base stats, Ascend them to increase their max level, train them on the Soul Tree to further improve specific stats, or link characters together to provide additional support. The choice is yours!"
Escape Simulator,casual,"Escape Simulator is a first-person puzzler you can play solo or in an online co-op. Explore a growing set of highly interactive escape rooms. Move furniture, pick up and examine everything, smash pots and break locks! Supports community-made rooms through the level editor. Interactive Puzzles : Rummage through 28 rooms filled with puzzles designed by real-life escape room operators. If something is not nailed to the wall, you can pick it up. Online Co-Op: All the rooms are playable in an online co-op. We recommend to play built-in rooms with up to 3 players ( but you're welcome to play with more ). Community rooms have been tested with up to 10 people. Customize your character and join with friends to work-out puzzles together. More heads are better than one! Examine Everything : Read through books, examine ancient artifacts and find clues to riddles. Need to cross-reference a clue? No, problem - just pin it to the screen. Community-Made Rooms : The game includes a room editor with which you can design your own escape rooms and puzzles. Through workshop integration, you get to play awesome things the community has created. Currently, there are more than 4000 community-rooms available! The rooms are arranged into packs: Labyrinth of Egypt ""You and your mentor discovered the ancient Labyrinth of Egypt. By accident, he activated a trap, and you got separated, with no way out in sight."" Adrift in Space ""An explosion wakes you up. Your spaceship has been hit by debris, and you're heading straight into the sun."" Edgewood Mansion ""You were invited to attend a special dinner at Dr. Edgewood's mansion. Instead of eating food, you'll be solving a victorian mystery."" Omega Corporation ""Your friend disappeared while investigating the mysterious Omega Corporation. Follow their tracks and uncover the truth."" Extras Escape Aperture Science Laboratories in a Portal themed room, escape the iconic Among Us spaceship, find a way out of Santa's Workshop , play with Cats in Time , visit a spooky Graveyard , a funky 70's Room , escape Leonardo da Vinci's workshop , find the pirate treasure on The Island , and in our latest room you can finally play Versus your friends!"
Sakura Clicker,casual,"The latest entry in the Sakura series is more action-packed than ever before! Sakura Clickers is a fast-paced, exciting adventure, full of content, in which you defeat your foes with the power of your mouse! Fearsome Foes - The battle never ends as you fight a horde of enemies, each one more powerful than the last as they attempt to impede your path. Customisable Characters - As you earn gold from slaying your foes, you can purchase and outfit your hero with a variety of costumes. Helpful Allies - You don't have to face these evils alone! As you progress you may also hire a number of allies that are dedicated to assisting you in fighting the evils that threaten the world. Also included is 800+ moans as you defeat the monsters. Voice Actors Credits: 北森あゆ Kitamori Ayu カンザキカナリ Kanzaki Canari 九十九円 Tsukumo Madoka 兼田めぐみ Kaneta Megumi 桐谷蝶々 Kiritani Choucho 土井友加里 Doi Yukari ありかわ真奈 Arikawa Mana 渋井美貴 Shibui Miki 工藤マミ Kudou Mami 飯田さち Iida Sachi 安田みずほ Yasuda Mizuho"
Project Winter,casual,"The ultimate test of trust and betrayal: do your friends have your back or will they leave you bleeding in the snow? Project Winter is an 8-person multiplayer game of survival and social deception, where cooperation is essential, but betrayal is inevitable. Stranded in the frozen wilderness, survivors must gather resources, repair objectives, and fight the elements to escape. But hidden among them are traitors working together to sabotage, mislead, and eliminate their so-called allies. Project Winter 2.0: Cabin Fever introduces a faster, more streamlined experience that keeps the paranoia and chaos alive while making it easier than ever for new players to jump in. For seasoned players, the punishing Classic mode remains - demanding coordination, grit, and sharp instincts to survive. No two matches are ever the same. Whether you’re chopping firewood with allies, whispering over secret radios as a traitor, or panicking when a sudden blizzard forces everyone together, the tension builds with every decision. PROJECT WINTER ROLES Survivor As a survivor you will have to complete a series of objectives in order to call in one of several rescue vehicles and escape to win the game. Repair all the objectives to restore the cabin radio to working order. Break rocks, harvest berries and herbs, and cut down trees to earn crafting materials used to repair objectives, and help keep you alive. Explore crates found in the buildings scattered throughout the map which contain items that will help you survive and complete your objectives. Traitor As a traitor your goal is to stop the survivors from escaping without being identified or killed. All of your teammates will be revealed to you at the start of the match and can be identified by a red traitor symbol, much like yours. You will start with a red radio to communicate with your fellow traitor. Use traitor crates and hatches scattered throughout the map to gain advantage against survivors. FEATURES Teamwork & Survival : Survivors can’t make it alone. Work together to endure the cold, complete objectives, and fend off wildlife. Betrayal & Deception : Traitors blend in, gain trust, and then strike when the moment is right. Anyone could be the enemy! Communication : Proximity voice, radio channels, text chat, and emotes keep every interaction charged with suspicion. Multiple Modes : Choose between streamlined Cabin Fever, unforgiving Classic, or customize your own rules for the perfect dose of paranoia. Cosmetics & Progression : Unlock stylish looks and personalize your character with cosmetics available in our in-game store, progression trees, or in-game drops. Can you trust your friends long enough to survive? Or will you be the reason no one makes it out alive?"
SpongeBob SquarePants: Battle for Bikini Bottom - Rehydrated,casual,"Are you ready, kids? The cult classic is back, faithfully remade in spongetastic splendor! Play as SpongeBob, Patrick and Sandy and show the evil Plankton that crime pays even less than Mr. Krabs. Want to save Bikini Bottom from lots of rampant robots with your mighty bubbles? Of course you do! Want to underpants bungee jump? Why wouldn't you! Want to join forces in a brand new multiplayer mode? The battle is on! GAME FEATURES Play as SpongeBob, Patrick and Sandy and use their unique sets of skills Thwart Plankton's evil plan to rule Bikini Bottom with his army of wacky robots Meet countless characters from the beloved series REMAKE FEATURES Faithful remake of one of the best SpongeBob games ever created High-end visuals, modern resolutions and carefully polished gameplay Brand new horde mode multiplayer for up to two players, online and offline Restored content that was cut from the original game like the Robo Squidward boss fight and more"
The Pillage,casual,"The Pillage is about an appetite for murder. It's about killing for sport and reaping organs for reward. It drops the player in a city with only three things, a small knife, a large weapon, and a desire to take the kidneys from every human in sight. Perfect for every player, it can be played casually or strategically depending on just what the player wants from the game and every play style is rewarded. Complex Intelligence Every swipe of the sword and every thrust of your knife creates a complex series of responses from the complicated AI. Citizens will tell the police if they see you commit a crime and police will act on what information they provide. Gangs will leave the player alone if not messed with and attack the player or other gangs when stimulated. It gets deeper than this but past that is a secret. Procedural Generation Nearly everything in this game is procedural: The buildings, the sky, the ground, AI characteristics (including all physical features and mobility), gang spawns, ghosts, and a dynamic difficulty curve for police spawns. Weapons The player is given a variety of weapons to choose from and purchase using kidneys in the shop. Both the fast attack and the power attack weapons can be swapped with multiple weapons available in each category. Perks You have the option to purchase different character perks when you get achievements. Only some of which include: more starting health, longer slow-motion, double-jumping, and faster speed. Special Abilities New in version 2.0.0, you can unlock special abilities. There are four options: sending crows down from the sky to kill people, becoming enraged which increases speed and adds invulnerability, spawning sidekicks to fight alongside you, and summoning a large eye to kill anything within range. Leaderboard The Pillage houses an awesome and informative leaderboard that keeps track of player scores across the world and provides a breakdown of their score. Sound The Pillage has an amazing theme and *new* soundtrack produced by David Sherman as well as some awesome sound effects from Vawlt."
Cell to Singularity - Evolution Never Ends,casual,"ROADMAP About the Game Tap into the extraordinary tale of evolution in this cosmic clicker game. Once upon a time, over 4.5 billion years ago, there was no life in the Solar System. And then, almost in the blink of an eye on the geologic time scale, everything changed. Deep in the primordial soup of Earth lay the organic compounds that would give rise to life’s humble origins. All it takes for this epic evolution game to unfold is you. Turn to the next page of evolution with every click. Gain entropy to unlock the next chapter of the evolution of life. Uncover the twists and turns that led to the great milestones of evolution: the extinction of the dinosaurs, the discovery of fire, the Industrial Revolution, and more. See chapters that have yet to be written -- a future evolution beyond the modern day. The epic story of evolution, technology, and humanity is yours to tap. It’s a breathtaking evolution game! The most accurate human evolution game on Earth! Countless hours of addictive--but very informative--clicker gameplay With every tap, earn Entropy--the evolutionary currency for life in the universe Simple, intuitive controls--click anywhere to gather Entropy for new animal Evolutions! Climb civilizations' Tech Tree by spending Ideas on countless scientific and technology upgrades It’s a science game about the development of life on Earth. View the fruits of evolution in beautiful 3D habitats. Unlock animals like Fish, Lizards, Mammals, Monkeys. Unlock the future of evolution and the mystery of the technological singularity. Discover and learn scientific facts about evolution of life and natural history as you play Enter a space odyssey into speculative science fiction as you click past modern civilization Get into a life creation mood thanks to an epic soundtrack of classical music Upgrade the evolution of a single cell organism into a civilization on the brink of a technological singularity Simulate the science of life on earth. Upgrade tech to Survive on Mars and Terraform Mars A science evolution game where you upgrade life, from a Single-Cell organism, to multi-celled organisms, fish, reptiles, mammals, monkeys, humans and beyond. Play the evolution of Life on Earth, all its past, present and future. Will humanity survive the next phase of evolution?"
Poker Night at the Inventory (2010 Original Version),casual,"***Not Compatible with Mac OS 10.8.x and above*** Prepare for a different kind of poker night in a very different kind of club. In Poker Night at the Inventory, you'll deal with Penny Arcade's clever, cunning Tycho, Team Fortress 2's hulking Heavy, Homestar Runner's self-proclaimed ""awesome icon"" Strong Bad and the hyperkinetic ""rabbity-thing"" from Sam & Max. These characters come together in ways some never thought possible, in a setting few would have predicted. Unlock new TF2 items by beating The Heavy, Max, Tycho, or Strong Bad at high stakes games of poker. The Enthusiast's Timepiece: Tycho's favorite timepiece (equippable by the Spy) License to Maim: Max's Badge (equippable by all classes) The Lugermorph: A second chance at Max's personal armament (equippable by the Scout and the Engineer) The Iron Curtain: The Heavy's first love (equippable by the Heavy, obviously) Dangeresque, Too?: Strong Bad's styling glasses (equippable by the Demoman)"
Bacteria,casual,"'Bacteria' - A new puzzle game from the creators of 'Energy Balance' and 'Energy Cycle'. This game is based on the rules of the cellular automaton ‘Life’ devised by John Horton Conway in 1970. (You can read more about how it works in greater details here: http://en.wikipedia.org/wiki/Conway's_Game_of_Life ) In 'Bacteria' you have a square game field that is in some form of a stable state. You need to add in a certain number of cells so that, after a few steps, the field will be halted (in colored mode) or even cleared (in ""hard"" black & white mode). You could draw in single points, or use standard 'Life' patterns like ""Gliders"" (they move at an angle) and ""Lightweight spaceships (LWSS)"" (they move in a straight line). Depending on the difficulty level, the player can use a smaller area to add new cells."
Her Story,casual,"Buy Sam Barlow's New Game! About the Game A Video Game About a Woman Talking to the Police Her Story is the award winning video game from Sam Barlow, creator of Silent Hill: Shattered Memories and Aisle. A crime fiction game with non-linear storytelling, Her Story revolves around a police database full of live action video footage. It stars Viva Seifert, actress and one half of the band Joe Gideon and the Shark. How does it work? Her Story sits you in front of a mothballed desktop computer that’s logged into a police database of video footage. The footage covers seven interviews from 1994 in which a British woman is interviewed about her missing husband. Explore the database by typing search terms, watch the clips where she speaks those words and piece together her story. Unlike anything you've played before, Her Story is an involving and moving experience. A game that asks you to listen."
The Wolf Among Us,casual,"From the makers of the 2012 Game of the Year: The Walking Dead, comes a gritty, violent and mature thriller based on the award-winning Fables comic books (DC Comics/Vertigo). As Bigby Wolf - THE big bad wolf - you will discover that a brutal, bloody murder is just a taste of things to come in a game series where your every decision can have enormous consequences. An evolution of Telltale's ground-breaking choice and consequence game mechanics will ensure the player learns that even as Bigby Wolf, Sheriff of Fabletown, life in the big bad city is bloody, terrifying and dangerous. Over a season of content spanning across 5 episodes: Episode 1: Faith - Available Now Episode 2: Smoke and Mirrors - Available Now Episode 3: A Crooked Mile - Available Now Episode 4: In Sheep's Clothing - Available Now Episode 5: Cry Wolf - Available Now Key Features From the team that brought you 2012 Game of the Year, The Walking Dead Based on the Eisner Award-winning Fables comic book series Now, it’s not only WHAT you choose to do that will affect your story, but WHEN you choose to do it A mature and gritty take on characters from fairytales, legends and folklore who have escaped into our world A perfect place to begin your Fables journey, even if you’ve not read the comics; this game is set before the events seen in the first issue"
Chinese Parents,casual,"In this casual yet realistic life sim with a Chinese authenticity, you step into the shoes of an average kid from the first day of life towards the end of your high school days. Study hard, have fun, make friends and face the “Gaokao”, one of the most critical examinations in your life. And perhaps this experience might also give you a special perspective to explore your relationships as a parent and as a child. A unique slice of life simulator You are a child born in an ordinary Chinese family. Prior to Gaokao, one of the most critical examinations, you have 18 years to enjoy your life and make choices to be yourself. Be a Chinese kid As a girl or a boy, different experiences from heartfully weaved stories and distinctive characters awaits you. Use “Fragments” to improve yourself Raise your stats with Fragment mini-game. Higher stats improve your character through learning new skills. Tiger Parent, or not? Scheduling every detail, either ensure a happy and stress-free life, or force the kid to study as hard as possible? It’s all up to you. Live the life as a Chinese child with various mini-games Expect a life full of challenges. Do you have what it takes to defeat your annoying and cocky neighbors in the Face Duel? Or can you maintain your cool while trying everything to grasp the Red Pocket against your relatives in a courtesy manner? Multiple friends to date with You are not alone, after all you need a social life. Choose and date with 14 friends in total with various interaction in order to know them better. Who knows what post-graduation fairy tales will happen to these childhood sweethearts? Over 100 career endings Persuade your dream career, and choose your own life. Will you settle to be an average nobody, or only after reaching the top of everything will your ambition be properly answered? Your family journeys on, from generation to generation Your child in the next game will benefit from your achievements in the previous generation. Don’t forget to check back your roots to find courage and wits for the future."
Universe Sandbox,casual,"Universe Sandbox is a realistic physics-based space simulator that allows you to create, destroy, and interact on an unimaginable scale. It merges real-time gravity, climate, collision, and material interactions to reveal the beauty of our universe and the fragility of our planet. Simulate Gravity N-body simulation at almost any speed using Newtonian mechanics. Real science, real physics, no supercomputer required. Collide Planets & Stars Epic, mind blowing collisions of massive planetary bodies that leave behind molten craters. Create Your Own Systems Start with a star, then add a planet. Spruce it up with moons, rings, comets, or even a black hole. Model Planetary Climate Watch sea ice grow and recede with the seasons because of a planet’s tilt - change the tilt and change the seasons. Or move planets close to a star and see the oceans boil away as the surface heats up. Supernova a Star Watch a supernova unfold by colliding two stars, cranking up their mass, or making them explode at your whim. Explore Historical Events Hitch a ride with spacecraft including Juno and New Horizons, or view a total solar eclipse. And more... Build and terraform planets with 12 materials, including water, oxygen, & carbon dioxide Stellar flares & volatile trails Procedurally generated planets, stars, & galaxies Pulsars Light-warping black holes Epic space lasers Shape oceans & mountains on planet surfaces Spin planets apart with centrifugal force Original soundtrack by Macoubre Support for 20+ languages Share & explore simulations on Steam Workshop"
inZOI,casual,"inZOI is a life simulation game where players step into the role of creators, shaping the world as they envision and witnessing the various stories that unfold. Through this immersive experience, we aim to inspire players to appreciate life as the profound gift it is—a journey that is filled with meaning at every turn. Step into diverse lives, brought to life with realistic graphics! inZOI features a fully functional community simulation experience where characters, known as Zois, live their lives with their own free will. Zois perform actions and build relationships based on their personalities and life experiences, leading to unexpected developments such as rumors, trends, and disease. Take control of cities inspired by real-world locations and shape them into the perfect backdrop for your own stories by modifying factors such as weather, properties, and streets. All of this comes to life with stunning, realistic graphics powered by Unreal Engine 5. Bring your imagination to life with endless customizations! inZOI offers advanced customization tools, empowering creators to freely design their characters and bring their imagination to reality. Choose from over 250 customization options to create your own unique Zoi, adjusting everything from hair, skin, and physique to outfits, accessories, nail art, and more. Mix and match architectural elements like walls, roofs, stairs, fences, platforms, and gates to create unique buildings. Decorate spaces with a variety of objects, and customize your furniture to make every detail your own. Bring your characters to life using inZOI's facial and motion capture capabilities, and create stunning videos set in your world of choice. Experience the joy of unbridled creativity! inZOI uses on-device generative AI technology to provide creators with additional customization options for an intuitive creative experience. Enter text prompts to generate custom patterns and images to customize outfits, props, and furniture to your liking. Transform 2D images into in-game 3D objects or create character motions by uploading your video files. Bring your imagination to life with these powerful tools! With limitless creative freedom, the possibilities are endless! Share your creations and connect with other creators! Easily share your creations and interact with other creators using Canvas, our in-game sharing platform. Showcase your characters, homes, and stories, or find inspiration from other creators. Join creators around the world on Canvas for a more connected inZOI experience!"
Townscaper,casual,"No goal. No real gameplay. Just plenty of building and plenty of beauty. That's it. Townscaper is an experimental passion project. More of a toy than a game. Pick colors from the palette, plop down colored blocks of houses on the irregular grid, and watch Townscaper's underlying algorithm automatically turn those blocks into cute little houses, arches, stairways, bridges, and lush backyards, depending on their configuration."
ShellShock Live,casual,"ShellShock Live is a strategic online multiplayer artillery game developed by kChamp Games. Fight Alongside your Friends (Or blow them up... we won't judge!) Take part in action-packed 8-Player team and free-for all battles. Tactical gameplay is essential to victory, while numerous distinct tanks, weapons, items, maps, and play styles make every match unique. Way Too Many Weapons It's a bit ridiculous. Unlock, upgrade, and master over 400 unique power-packed weapons, from the intimidating 'Seagull' to the ever-powerful 'Mega-Nuke'. The best part is that we're building and adding more daily. Loads of Modes Armored carnage must get old after a while, right? Wrong. Unique game modes keep things fresh and give you the opportunity to demolish tanks in a multitude of ways. Become the Best There Ever Was Earn XP to level up and become king of the battlefield. Play through 100 unique ranks, each with their own rewards and unlocks. Global leaderboards and rankings keep things spicy. Upgrade Everything And when we say everything, we mean everything. Upgrade your tank. Upgrade your skills. Upgrade your items. Upgrade your arsenal. All 400+ of the game's weapons can be upgraded to more powerful versions. Nature Doesn't Stand a Chance Fully destructible terrain creates a dynamically changing battlefield. Earthquakes and other natural disasters keep you on your toes (just like in real life!) (Very) Active Development We've been cranking out ShellShock Live updates with new features and awesome community suggestions almost daily. Check out the Announcements section for full release notes, or join the community on the Forums. Non-Evil Developers All gameplay content is earned by playing, not paying. Any content that can be purchased is purely cosmetic and can only benefit other players and the community."
